{
  "schema_version": "2.0.0",
  "release": {
    "version": "v1.0.0-migrated",
    "released_at": "2025-10-23T10:58:51.312484Z",
    "template_sha": "migrated",
    "changelog_url": "",
    "description": "Migrated from blueprint-config.json on 2025-10-23"
  },
  "topology": {
    "network": {
      "name": "llm",
      "subnet": "10.89.0.0/24",
      "gateway": "10.89.0.1"
    },
    "services": {
      "litellm_postgres": {
        "infrastructure": {
          "image": "docker.io/pgvector/pgvector:pg16",
          "container_name": "litellm-postgres",
          "port": 5432,
          "network": "llm.network",
          "description": "litellm_postgres service",
          "hostname": "litellm-postgres",
          "published_port": null,
          "requires": [],
          "enabled": true,
          "volumes": [
            {
              "name": "litellm-postgres.volume",
              "mount_path": "/var/lib/postgresql/data",
              "selinux_label": "Z"
            }
          ],
          "healthcheck": {
            "cmd": "pg_isready -U litellm",
            "interval": "10s",
            "timeout": "5s",
            "retries": 5,
            "start_period": "10s"
          }
        },
        "configuration": {
          "type": "object",
          "properties": {
            "POSTGRES_USER": {
              "type": "string",
              "description": "Database user",
              "default": "litellm",
              "x-env-var": "POSTGRES_USER",
              "x-category": "Advanced",
              "x-visibility": "expert"
            },
            "POSTGRES_DB": {
              "type": "string",
              "description": "Database name",
              "default": "litellm",
              "x-env-var": "POSTGRES_DB",
              "x-category": "Advanced",
              "x-visibility": "expert"
            }
          }
        }
      },
      "litellm_redis": {
        "infrastructure": {
          "image": "docker.io/redis:latest",
          "container_name": "litellm-redis",
          "port": 6379,
          "network": "llm.network",
          "description": "litellm_redis service",
          "hostname": "litellm-redis",
          "published_port": null,
          "requires": [],
          "enabled": true,
          "volumes": [
            {
              "name": "litellm-redis.volume",
              "mount_path": "/data",
              "selinux_label": "Z"
            }
          ],
          "healthcheck": {
            "cmd": "redis-cli ping || exit 1",
            "interval": "10s",
            "timeout": "5s",
            "retries": 5,
            "start_period": "5s"
          }
        },
        "configuration": {
          "type": "object",
          "properties": {}
        }
      },
      "litellm": {
        "infrastructure": {
          "image": "ghcr.io/berriai/litellm:main-stable",
          "container_name": "litellm",
          "port": 4000,
          "network": "llm.network",
          "description": "LLM Proxy Service",
          "hostname": "litellm",
          "published_port": 4000,
          "requires": [
            "litellm_postgres",
            "litellm_redis"
          ],
          "enabled": true,
          "external_subdomain": "llm",
          "healthcheck": {
            "cmd": "curl -f http://localhost:4000/health || exit 1",
            "interval": "30s",
            "timeout": "5s",
            "retries": 3,
            "start_period": "30s"
          }
        },
        "configuration": {
          "type": "object",
          "properties": {
            "LITELLM_MASTER_KEY": {
              "type": "string",
              "description": "Master authentication key for LiteLLM proxy",
              "default": "${LITELLM_MASTER_KEY}",
              "x-env-var": "LITELLM_MASTER_KEY",
              "x-category": "Security",
              "x-display-order": 1,
              "x-visibility": "exposed",
              "x-sensitive": true,
              "x-secret-ref": "secrets.api_keys.litellm_master",
              "x-template-path": "litellm.master_key"
            },
            "DATABASE_URL": {
              "type": "string",
              "description": "PostgreSQL connection for LiteLLM state",
              "default": "postgresql://litellm@litellm-postgres:5432/litellm",
              "x-env-var": "DATABASE_URL",
              "x-category": "Advanced",
              "x-visibility": "expert",
              "x-template-path": "litellm.database_url",
              "x-requires-field": "litellm_postgres.infrastructure.container_name"
            },
            "REDIS_URL": {
              "type": "string",
              "description": "Redis cache for rate limiting and caching",
              "default": "redis://litellm-redis:6379/0",
              "x-env-var": "REDIS_URL",
              "x-category": "Advanced",
              "x-visibility": "expert",
              "x-template-path": "litellm.redis_url",
              "x-requires-field": "litellm_redis.infrastructure.container_name"
            },
            "DROP_PARAMS": {
              "type": "boolean",
              "description": "Drop unsupported parameters instead of erroring",
              "default": true,
              "x-env-var": "DROP_PARAMS",
              "x-category": "Advanced",
              "x-display-order": 4,
              "x-visibility": "advanced",
              "x-template-path": "litellm.drop_params",
              "x-rationale": "Improves compatibility with different model providers"
            }
          }
        }
      },
      "openwebui_postgres": {
        "infrastructure": {
          "image": "docker.io/pgvector/pgvector:pg16",
          "container_name": "openwebui-postgres",
          "port": 5432,
          "network": "llm.network",
          "description": "openwebui_postgres service",
          "hostname": "openwebui-postgres",
          "published_port": null,
          "requires": [],
          "enabled": true,
          "volumes": [
            {
              "name": "openwebui-postgres.volume",
              "mount_path": "/var/lib/postgresql/data",
              "selinux_label": "Z"
            }
          ],
          "healthcheck": {
            "cmd": "pg_isready -U openwebui",
            "interval": "10s",
            "timeout": "5s",
            "retries": 5,
            "start_period": "10s"
          }
        },
        "configuration": {
          "type": "object",
          "properties": {
            "POSTGRES_USER": {
              "type": "string",
              "description": "Database user",
              "default": "openwebui",
              "x-env-var": "POSTGRES_USER",
              "x-category": "Advanced",
              "x-visibility": "expert"
            },
            "POSTGRES_DB": {
              "type": "string",
              "description": "Database name",
              "default": "openwebui",
              "x-env-var": "POSTGRES_DB",
              "x-category": "Advanced",
              "x-visibility": "expert"
            }
          }
        }
      },
      "openwebui_redis": {
        "infrastructure": {
          "image": "docker.io/redis:latest",
          "container_name": "openwebui-redis",
          "port": 6379,
          "network": "llm.network",
          "description": "openwebui_redis service",
          "hostname": "openwebui-redis",
          "published_port": null,
          "requires": [],
          "enabled": true,
          "volumes": [
            {
              "name": "openwebui-redis.volume",
              "mount_path": "/data",
              "selinux_label": "Z"
            }
          ],
          "healthcheck": {
            "cmd": "redis-cli ping || exit 1",
            "interval": "10s",
            "timeout": "5s",
            "retries": 5,
            "start_period": "5s"
          }
        },
        "configuration": {
          "type": "object",
          "properties": {}
        }
      },
      "openwebui": {
        "infrastructure": {
          "image": "ghcr.io/open-webui/open-webui:main",
          "container_name": "openwebui",
          "port": 8080,
          "network": "llm.network",
          "description": "Open WebUI Chat Interface",
          "hostname": "openwebui",
          "published_port": 3000,
          "requires": [
            "openwebui_postgres",
            "openwebui_redis",
            "litellm"
          ],
          "enabled": true,
          "websocket": true,
          "external_subdomain": "ai",
          "volumes": [
            {
              "name": "openwebui.volume",
              "mount_path": "/data",
              "selinux_label": "Z"
            }
          ],
          "healthcheck": {
            "cmd": "curl -f http://localhost:8080/health || exit 1",
            "interval": "30s",
            "timeout": "5s",
            "retries": 3,
            "start_period": "30s"
          }
        },
        "configuration": {
          "type": "object",
          "properties": {
            "WEBUI_NAME": {
              "type": "string",
              "description": "Main WebUI display name",
              "default": "Leger AI",
              "x-env-var": "WEBUI_NAME",
              "x-category": "General",
              "x-display-order": 1,
              "x-visibility": "exposed",
              "x-template-path": "openwebui.general.webui_name"
            },
            "WEBUI_AUTH": {
              "type": "boolean",
              "description": "Enable user authentication",
              "default": false,
              "x-env-var": "WEBUI_AUTH",
              "x-category": "Security",
              "x-display-order": 1,
              "x-visibility": "exposed",
              "x-template-path": "openwebui.general.webui_auth"
            },
            "ENABLE_WEB_SEARCH": {
              "type": "boolean",
              "description": "Enable web search functionality",
              "default": true,